user_id,status_id,date,screen_name,text,source,display_text_width,reply_to_status_id,reply_to_user_id,reply_to_screen_name,is_quote,is_retweet,favorite_count,retweet_count,quote_count,reply_count,hashtags,symbols,urls_url,urls_t.co,urls_expanded_url,media_url,media_t.co,media_expanded_url,media_type,ext_media_url,ext_media_t.co,ext_media_expanded_url,ext_media_type,mentions_user_id,mentions_screen_name,lang,quoted_status_id,quoted_text,quoted_created_at,quoted_source,quoted_favorite_count,quoted_retweet_count,quoted_user_id,quoted_screen_name,quoted_name,quoted_followers_count,quoted_friends_count,quoted_statuses_count,quoted_location,quoted_description,quoted_verified,retweet_status_id,retweet_text,retweet_created_at,retweet_source,retweet_favorite_count,retweet_retweet_count,retweet_user_id,retweet_screen_name,retweet_name,retweet_followers_count,retweet_friends_count,retweet_statuses_count,retweet_location,retweet_description,retweet_verified,place_url,place_name,place_full_name,place_type,country,country_code,geo_coords,coords_coords,bbox_coords,status_url,name,location,description,url,protected,followers_count,friends_count,listed_count,statuses_count,favourites_count,account_created_at,verified,profile_url,profile_expanded_url,account_lang,profile_banner_url,profile_background_url,profile_image_url
18713552,1192079261764608000,2019-11-06T14:00:18Z,NRDC,"Chicago’s industrial legacy continues to be a burden on working-class communities of color, like the one NRDC's @GinaRamirez311 lives in. That's why the city needs to focus on environmental justice.👇https://t.co/UzlX69WFRL",Sprout Social,222,,,,FALSE,FALSE,20,16,,,,,nrdc.org/experts/priori…,https://t.co/UzlX69WFRL,https://www.nrdc.org/experts/prioritizing-environmental-justice-chicago?utm_source=tw&utm_medium=tweet&utm_campaign=Climate,,,,,,,,,1017202866077958145,GinaRamirez311,en,,,,,,,,,,,,,,,,,,,,,,,,,,,,,,,,,,,,,|,|,|||||||,https://twitter.com/NRDC/status/1192079261764608000,NRDC 🌎,Planet Earth,"Natural Resources Defense Council | The Earth's Best Defense",https://t.co/GFqNSZ8jzJ,FALSE,330583,3687,7819,89486,10919,2009-01-07T06:35:20Z,TRUE,https://t.co/GFqNSZ8jzJ,http://www.nrdc.org/,,https://pbs.twimg.com/profile_banners/18713552/1502222318,http://abs.twimg.com/images/themes/theme5/bg.gif,http://pbs.twimg.com/profile_images/1176930945393418243/UFtBF9Vj_normal.png
34113439,1192189038754717708,2019-11-06T21:16:31Z,SierraClub,"It’s been one year since the Portland Clean Energy Fund made history as the first initiative created and led by communities of color to fund climate justice and jobs in the United States.

Help us celebrate this incredible effort with @PDXCleanEnergy! 
https://t.co/gkAI0VlayQ",Twitter Web App,276,,,,FALSE,FALSE,19,11,,,,,youtube.com/watch?v=J363H4…,https://t.co/gkAI0VlayQ,https://www.youtube.com/watch?v=J363H4sdNcs&feature=youtu.be,,,,,,,,,986011174587154434,PDXCleanEnergy,en,,,,,,,,,,,,,,,,,,,,,,,,,,,,,,,,,,,,,|,|,|||||||,https://twitter.com/SierraClub/status/1192189038754717708,Sierra Club,"","Since 1892, the Sierra Club has been working to protect communities, wild places, and the planet itself",,FALSE,361976,5046,7059,129178,7581,2009-04-22T00:42:18Z,TRUE,,,,https://pbs.twimg.com/profile_banners/34113439/1551198809,http://abs.twimg.com/images/themes/theme1/bg.png,http://pbs.twimg.com/profile_images/1173681910129790976/kkQFD34s_normal.jpg
34113439,1192200160744480771,2019-11-06T22:00:42Z,SierraClub,The Portland Clean Energy Fund passed 1 year ago today. This historic initiative was led by communities of color to fund climate justice and clean energy jobs in the US. Learn how @PDXCleanEnergy is ensuring the clean energy transition is equitable: https://t.co/a4TJ7Z2XSR,Hootsuite Inc.,273,,,,FALSE,FALSE,11,7,,,,,sierraclub.org/press-releases…,https://t.co/a4TJ7Z2XSR,https://www.sierraclub.org/press-releases/2019/11/portland-clean-energy-fund-coalition-celebrates-first-anniversary-ballot,,,,,,,,,986011174587154434,PDXCleanEnergy,en,,,,,,,,,,,,,,,,,,,,,,,,,,,,,,,,,,,,,|,|,|||||||,https://twitter.com/SierraClub/status/1192200160744480771,Sierra Club,"","Since 1892, the Sierra Club has been working to protect communities, wild places, and the planet itself",,FALSE,361976,5046,7059,129178,7581,2009-04-22T00:42:18Z,TRUE,,,,https://pbs.twimg.com/profile_banners/34113439/1551198809,http://abs.twimg.com/images/themes/theme1/bg.png,http://pbs.twimg.com/profile_images/1173681910129790976/kkQFD34s_normal.jpg
34113439,1192181635569143809,2019-11-06T20:47:06Z,SierraClub,"It’s the one-year anniversary of the Portland Clean Energy Fund! Join us and @PDXCleanEnergy for a webinar detailing this powerful example of communities of color at the frontlines of climate change and the clean energy transition. https://t.co/MHh07TKiRF
https://t.co/gkAI0VlayQ",Twitter Web App,279,,,,FALSE,FALSE,10,3,,,,,sc.org/PDXCleanEnergy|youtube.com/watch?v=J363H4…,https://t.co/MHh07TKiRF|https://t.co/gkAI0VlayQ,http://sc.org/PDXCleanEnergy|https://www.youtube.com/watch?v=J363H4sdNcs&feature=youtu.be,,,,,,,,,986011174587154434,PDXCleanEnergy,en,,,,,,,,,,,,,,,,,,,,,,,,,,,,,,,,,,,,,|,|,|||||||,https://twitter.com/SierraClub/status/1192181635569143809,Sierra Club,"","Since 1892, the Sierra Club has been working to protect communities, wild places, and the planet itself",,FALSE,361976,5046,7059,129178,7581,2009-04-22T00:42:18Z,TRUE,,,,https://pbs.twimg.com/profile_banners/34113439/1551198809,http://abs.twimg.com/images/themes/theme1/bg.png,http://pbs.twimg.com/profile_images/1173681910129790976/kkQFD34s_normal.jpg
34113439,1192196248457097216,2019-11-06T21:45:10Z,SierraClub,"#PDXCleanEnergy is a groundbreaking clean energy solution that addresses climate, economic, and racial justice. Join us on Nov. 21 to learn more about this historic initiative created and led communities of color in Portland, OR. https://t.co/MHh07TKiRF",Hootsuite Inc.,253,,,,FALSE,FALSE,5,2,,,PDXCleanEnergy,,sc.org/PDXCleanEnergy,https://t.co/MHh07TKiRF,http://sc.org/PDXCleanEnergy,,,,,,,,,,,en,,,,,,,,,,,,,,,,,,,,,,,,,,,,,,,,,,,,,|,|,|||||||,https://twitter.com/SierraClub/status/1192196248457097216,Sierra Club,"","Since 1892, the Sierra Club has been working to protect communities, wild places, and the planet itself",,FALSE,361976,5046,7059,129178,7581,2009-04-22T00:42:18Z,TRUE,,,,https://pbs.twimg.com/profile_banners/34113439/1551198809,http://abs.twimg.com/images/themes/theme1/bg.png,http://pbs.twimg.com/profile_images/1173681910129790976/kkQFD34s_normal.jpg
34113439,1192190303760977921,2019-11-06T21:21:32Z,SierraClub,@PDXCleanEnergy Join us for a webinar on November 21 to learn more about this powerful example of communities of color at the frontlines of climate change and the clean energy transition. https://t.co/MHh07TKiRF,Twitter Web App,195,1192189993839742976,34113439,SierraClub,FALSE,FALSE,11,4,,,,,sc.org/PDXCleanEnergy,https://t.co/MHh07TKiRF,http://sc.org/PDXCleanEnergy,,,,,,,,,986011174587154434,PDXCleanEnergy,en,,,,,,,,,,,,,,,,,,,,,,,,,,,,,,,,,,,,,|,|,|||||||,https://twitter.com/SierraClub/status/1192190303760977921,Sierra Club,"","Since 1892, the Sierra Club has been working to protect communities, wild places, and the planet itself",,FALSE,361976,5046,7059,129178,7581,2009-04-22T00:42:18Z,TRUE,,,,https://pbs.twimg.com/profile_banners/34113439/1551198809,http://abs.twimg.com/images/themes/theme1/bg.png,http://pbs.twimg.com/profile_images/1173681910129790976/kkQFD34s_normal.jpg
34113439,1192190023954767872,2019-11-06T21:20:26Z,SierraClub,@PDXCleanEnergy Join us for a webinar on November 21 to learn more about this powerful example of communities of color at the frontlines of climate change and the clean energy transition. https://t.co/MHh07TKiRF,Twitter Web App,195,1192189949916917760,34113439,SierraClub,FALSE,FALSE,3,2,,,,,sc.org/PDXCleanEnergy,https://t.co/MHh07TKiRF,http://sc.org/PDXCleanEnergy,,,,,,,,,986011174587154434,PDXCleanEnergy,en,,,,,,,,,,,,,,,,,,,,,,,,,,,,,,,,,,,,,|,|,|||||||,https://twitter.com/SierraClub/status/1192190023954767872,Sierra Club,"","Since 1892, the Sierra Club has been working to protect communities, wild places, and the planet itself",,FALSE,361976,5046,7059,129178,7581,2009-04-22T00:42:18Z,TRUE,,,,https://pbs.twimg.com/profile_banners/34113439/1551198809,http://abs.twimg.com/images/themes/theme1/bg.png,http://pbs.twimg.com/profile_images/1173681910129790976/kkQFD34s_normal.jpg
